Key,Summary,Project,Assignee,Description,Status,Issue Type,Created Date,Comments
SH-4895,RC/ DC few commands response skipped issue,Success Hub,Naman,RC/ DC few commands response skipped issue,BUG_Raised,Issue,2025-04-11T14:06:52.212+0530,"Naman: [Changing the Issue type to Issue] - Update - we see an intermittent miss by Pull Service in inserting completed commands in NoHangFire, to counter the same we have scheduled a job to complete the miss if any occurs. Had raised a bug for the same previously attaching the same here. CC:      sir"
SH-4894,RC - DC Data 15 Feb - 01 April,Success Hub,Naman,RC - DC Data 15 Feb - 01 April,Close,Service Request,2025-04-11T14:05:31.367+0530,"Naman: Update - All the required data had been provided over teams successfully previously. ~ Moving this in review, let me know if anything is remaining. CC:    | Automation for Jira: Hi Reporter, This Ticket is now moved to Review state and will be closed after T+3 business days. Please review this ticket and re-assign if any further assistance required from App Support | Automation for Jira: Dear Reporter, The ticket is closed as no response is received in T+3 days. Please reach out to App Support if any issues or concerns."
SH-4893,Billing Data Repush,Success Hub,Naman,Billing Data Repush,Close,Service Request,2025-04-11T14:03:56.555+0530,"Naman: Update - All the required had been repushed successfully. ~ Moving this in review, let me know if anything is remaining. CC:    | Automation for Jira: Hi Reporter, This Ticket is now moved to Review state and will be closed after T+3 business days. Please review this ticket and re-assign if any further assistance required from App Support | Automation for Jira: Dear Reporter, The ticket is closed as no response is received in T+3 days. Please reach out to App Support if any issues or concerns."
SH-4892,Power outage data is required for the meters breaching SLA between 09-04-25 to 11-04-25.,Success Hub,Shiva Sharma," , Please provide the outage data for the attached list of meters, as they have been breaching SLA continuously over the past 3 days due to power outages leading to major SLA breach. CC :   ",In Progress,Issue,2025-04-11T13:31:13.922+0530,"Shiva Sharma: Hi Sakshi,  Here is the outage data   Outage Meters March  of outage of more than 8 hours"
SH-4891,Bill pending of following meters in Apraava APDCL project.,Success Hub,Shiva Sharma," , I have attached the list of meters with pending bills due to the mentioned reasons.  Kindly look into this issue as it has been escalated by the client. CC:   ",Open,Issue,2025-04-11T13:12:16.202+0530,amit kumar sharma:  Please look into it as early as possible. Anamika is continuously following for this | amit kumar sharma: 
SH-4889,Meter nameplate not registered,Success Hub,Parveen Soni,010406206 meter numbers nameplate is not registered in HES.,Close,Issue,2025-04-11T12:00:22.181+0530,"Parveen Soni: done | Automation for Jira: Hi Reporter, This Ticket is now moved to Review state and will be closed after T+3 business days. Please review this ticket and re-assign if any further assistance required from App Support | Harsh Agarwal:  sir, The meter’s nameplate is showing, but no routing or IP packets have been received. Therefore, meter is still showing in non-comm on MDM. | Parveen Soni: This is Never comm meter | Automation for Jira: Hi Reporter, This Ticket is now moved to Review state and will be closed after T+3 business days. Please review this ticket and re-assign if any further assistance required from App Support | Harsh Agarwal:  , Ok sir, thanks | Automation for Jira: Dear Reporter, The ticket is closed as no response is received in T+3 days. Please reach out to App Support if any issues or concerns."
SH-4888,Sikkim Anvil: Routing count required for last three days of all the meter.,Success Hub,Ansh Sharma,"Dear   , As discussed, please share the routing details of all the meters as i want to see how many times all meters are routing per day. Please mention time, date and all the details. CC:      FYI only.",Close,Service Request,2025-04-11T10:32:00.040+0530,"Aditya Pradhan: Dear   please share the report. It is urgent. | Ansh Sharma:  | Automation for Jira: Hi Reporter, This Ticket is now moved to Review state and will be closed after T+3 business days. Please review this ticket and re-assign if any further assistance required from App Support | Automation for Jira: Dear Reporter, The ticket is closed as no response is received in T+3 days. Please reach out to App Support if any issues or concerns."
SH-4886,Intelli Pkg 1&2 RC-DC command not getting success,Success Hub,Parveen Soni,No description,Close,Incident,2025-04-11T09:14:28.970+0530,"Saiful Ali Khan:   RC command not getting success  CC-      | Shiva Sharma: Hi    As discussed over a group chat, the commands are working now and have succeeded for comm meters. Can you please review it? | Shiva Sharma: Issue:  Other commands were executing successfully, but we observed only RC/DC for communication meter processing, which did not succeed. Fix:  Switching the template to DLMS resolved the issue for standalone meter commands. Additionally, other commands also started succeeding after restarting the service. | Krishnamani: Routing available , rc/dc command is processing but meters are not getting success, kindly check    | Parveen Soni: I can see out of 170 only 20 meters are in communication  Book2 (1).xlsx"
SH-4872,Need to add Miss packet for SAT-4 meters,Success Hub,Ritik Kumar,"Hi, Please add miss packet for SAT-4 meters.",Close,Service Request,2025-04-10T15:38:32.934+0530,"Jitendra Verma:  Please add missed packet for remaining meters for the date range is (1st Apr to 9th Apr).   | Jitendra Verma:  sir, can you please help in this ticket since Ritik is not Available, is required for SAT-4. | Jitendra Verma:  Please add missed packet for remaining meters for the date range is (16th Mar to 11th Apr).   | Ritik Kumar:   please first send me the meter list for SAT 4 | Ritik Kumar: almost 60K gap reading commands are added and it took more than 2 hrs to complete the whole process. | Ritik Kumar:   This approach isn’t ideal, and we should avoid repeating it as it's putting unnecessary strain on the database. Kindly conduct a more in-depth analysis and categorize the meters based on SLA as follows: Let’s try to fetch complete data for  Category 1  first, followed by  Category 2 , and finally  Category 3 . This prioritization will help reduce the number of commands being added, improve performance, and enhance overall efficiency. | Ritik Kumar:  commands have fallen into a final state, what next? hs SLA improved we need to raise a few more GRs? | Jitendra Verma:  Please share updated SLA date range is 16th Mar to 13th Apr. PFA Meter list for SAT-4.   | Ritik Kumar:   pfa:   | Jitendra Verma: I have completed the in-depth analysis and categorized the meters based on the SLA ranges provided:      Please add missed packet for remaining meters for the date range is (16th Mar to 13th Apr). | Ritik Kumar: sure | Ritik Kumar:   Dividing 10K meters into 3 different sheets wasn’t what I was asking for. My main concern is to first focus on meters where the SLA is below 50%. In this case, there are only 475 such meters, and my approach is to prioritize getting the SLA sorted for these first. So, I’ll initiate commands only for these meters for now. Once you confirm we’re good to proceed with the next set — the meters with SLA between 50% and 90% — we’ll move forward with those accordingly. Sharing all 10K meters at once is not helping, as it puts an unnecessary load on the DB. I hope this clarifies things. If not, please feel free to connect and we can discuss it further. CC:    | Ritik Kumar: commands have been raised for meters having SLA below 50% | Jitendra Verma:   Okay we will first target on SLA below 50% after improved SLA then move on 50% to 90% category. | Jitendra Verma:  Commands are completed please share updated SLA date range is 16th Mar to 14th Apr. PFA Meter list:     | Ritik Kumar:   PFA   | Ritik Kumar: also the SLA in improved much so re-initiate the commands again  | Ritik Kumar:  | Ritik Kumar: commands have been added for more than 90% sla meters    select count(*),status from HESCommand nolock where commandtypeid = 21 and CreatedBy = 'GapFill_90% to 99.99%' and CreatedDate between '2025-04-14 18:30' and GETUTCDATE() group by status | Ritik Kumar:   PFA update SLA for meters where SLA was more than 90% please check and let me know if we are having improvement here or not (meter-wise)   | Jitendra Verma:  Yes, SLA has improved. But the SLA data you shared for 16 March is incorrect — it shows a higher value in HES then as compared to report given by you yesterday. | Ansh Sharma:  | Jitendra Verma:  Please add missed packet for (50% to 90% category) meters for the date range are (16th Mar to 15th Apr).   | Ritik Kumar:   GR commands are now being added for all 3 categories. This means we have initiated the commands on all the 10k meters to get the most data pulled from the most meters. commands have been added with 3 different created by’s: 1. GapFill_0% to 49.99%_17 2. GapFill_50% to 89.99%_17 3. GapFill_00% to 99.99%_17 | Jitendra Verma:   please share updated SLA date range is 16th Mar to 16th Apr. | Ritik Kumar:   PFA   | Jitendra Verma:  Please add missed packet for (50% to 90% category) meters for the date range are (16th Mar to 16th Apr). First add command for (50% to 90% category) after the completed then add for (90% to 99.99% category).   | Ritik Kumar: added: | Jitendra Verma:  Commands are completed please add command for 90% to 99.99% category. | Ritik Kumar: added: select count(*),status from HESCommand nolock where commandtypeid = 21 and CreatedBy = 'GapFill_90% to 99.99-18%' and CreatedDate between '2025-04-17 18:30' and GETUTCDATE() group by status | Jitendra Verma:  Please Share Updated SLA for date range is 22nd Mar to 17th Apr. PFA Updated Meter List for SAT-4,   | Ritik Kumar:   PFA updated LS SLA for new sat 4 list    | Jitendra Verma:   Please add missed packet for (50% to 90% category) meters for the date range are (22nd Mar to 17th Apr). First add command for (50% to 90% category) after the completed then add for (90% to 99.99% category).   | Ritik Kumar: I’m initiating the commands all together  | Ritik Kumar:   pfa update sla ater commands:   | Jitendra Verma:  Please add missed packet for (50% to 90% category) meters for the date range are (22nd Mar to 17th Apr). First add command for (50% to 90% category) after the completed then add for (90% to 99.99% category).    | Ritik Kumar: raising | Ritik Kumar: commands on both lists have been added: select count(*),status from HESCommand nolock where commandtypeid = 21 and CreatedBy = 'GapFill_50% to 99.99-20%' and CreatedDate between '2025-04-19 18:30' and GETUTCDATE() group by status | Jitendra Verma:  Please Share updated SLA for SAT-4 date range is 22nd Mar to 20th Apr. | Ritik Kumar:   PFA:   | Ritik Kumar: I’m closing this ticket now as it’s been a while for this ticket. please raise a separate as ticket SLA is also impacted | Automation for Jira: Hi Reporter, This Ticket is now moved to Review state and will be closed after T+3 business days. Please review this ticket and re-assign if any further assistance required from App Support | Automation for Jira: Dear Reporter, The ticket is closed as no response is received in T+3 days. Please reach out to App Support if any issues or concerns."
SH-4870,HP | Insert Event ID's in event table,Success Hub,Ayush Rajput,"IF NOT EXISTS (SELECT 1 FROM [dbo].[Event] WHERE EventId IN (20000, 20001, 20002, 20003, 20004, 20005, 20006, 20007, 20008, 20009, 20010, 20011, 20012, 20013)) BEGIN INSERT INTO dbo.Event (EventId, EventName, EventRelatedTo, FormattedProfileObisCode, FormattedEventObisCode, AttributeId) VALUES ('20000', '[HES Specific] [HES Specific] FTP_Not_connected', 'HES Specific', NULL, '255.255.255.255.255.255', '255'); INSERT INTO dbo.Event (EventId, EventName, EventRelatedTo, FormattedProfileObisCode, FormattedEventObisCode, AttributeId) VALUES ('20001', '[HES Specific] FTP_init', 'HES Specific', NULL, '255.255.255.255.255.255', '255'); INSERT INTO dbo.Event (EventId, EventName, EventRelatedTo, FormattedProfileObisCode, FormattedEventObisCode, AttributeId) VALUES ('20002', '[HES Specific] FTP_Connecting', 'HES Specific', NULL, '255.255.255.255.255.255', '255'); INSERT INTO dbo.Event (EventId, EventName, EventRelatedTo, FormattedProfileObisCode, FormattedEventObisCode, AttributeId) VALUES ('20003', '[HES Specific] FTP_Login_Success', 'HES Specific', NULL, '255.255.255.255.255.255', '255'); INSERT INTO dbo.Event (EventId, EventName, EventRelatedTo, FormattedProfileObisCode, FormattedEventObisCode, AttributeId) VALUES ('20004', '[HES Specific] FTP_Login_fail', 'HES Specific', NULL, '255.255.255.255.255.255', '255'); INSERT INTO dbo.Event (EventId, EventName, EventRelatedTo, FormattedProfileObisCode, FormattedEventObisCode, AttributeId) VALUES ('20005', '[HES Specific] FTP_Download_Start', 'HES Specific', NULL, '255.255.255.255.255.255', '255'); INSERT INTO dbo.Event (EventId, EventName, EventRelatedTo, FormattedProfileObisCode, FormattedEventObisCode, AttributeId) VALUES ('20006', '[HES Specific] FTP_Downloading', 'HES Specific', NULL, '255.255.255.255.255.255', '255'); INSERT INTO dbo.Event (EventId, EventName, EventRelatedTo, FormattedProfileObisCode, FormattedEventObisCode, AttributeId) VALUES ('20007', '[HES Specific] FTP_Downloaded', 'HES Specific', NULL, '255.255.255.255.255.255', '255'); INSERT INTO dbo.Event (EventId, EventName, EventRelatedTo, FormattedProfileObisCode, FormattedEventObisCode, AttributeId) VALUES ('20008', '[HES Specific] FTP_Error', 'HES Specific', NULL, '255.255.255.255.255.255', '255'); INSERT INTO dbo.Event (EventId, EventName, EventRelatedTo, FormattedProfileObisCode, FormattedEventObisCode, AttributeId) VALUES ('20009', '[HES Specific] FTP_Logging_out', 'HES Specific', NULL, '255.255.255.255.255.255', '255'); INSERT INTO dbo.Event (EventId, EventName, EventRelatedTo, FormattedProfileObisCode, FormattedEventObisCode, AttributeId) VALUES ('20010', '[HES Specific] FTP_Logout', 'HES Specific', NULL, '255.255.255.255.255.255', '255'); INSERT INTO dbo.Event (EventId, EventName, EventRelatedTo, FormattedProfileObisCode, FormattedEventObisCode, AttributeId) VALUES ('20011', '[HES Specific] FTP_Close', 'HES Specific', NULL, '255.255.255.255.255.255', '255'); INSERT INTO dbo.Event (EventId, EventName, EventRelatedTo, FormattedProfileObisCode, FormattedEventObisCode, AttributeId) VALUES ('20012', '[HES Specific] FOTA_Failed', 'HES Specific', NULL, '255.255.255.255.255.255', '255'); INSERT INTO dbo.Event (EventId, EventName, EventRelatedTo, FormattedProfileObisCode, FormattedEventObisCode, AttributeId) VALUES ('20013', '[HES Specific] FOTA_Success', 'HES Specific', NULL, '255.255.255.255.255.255', '255'); END; GO",Close,Issue,2025-04-10T14:27:10.252+0530,"Atul Raj:   has done it already | Automation for Jira: Hi Reporter, This Ticket is now moved to Review state and will be closed after T+3 business days. Please review this ticket and re-assign if any further assistance required from App Support"
SH-4868,HES not able to access HES UI APDCL IntelliSmart Pkg-1&2,Success Hub,Parveen Soni,No description,Close,Incident,2025-04-10T12:18:08.815+0530,Saiful Ali Khan:  | Jagdeep Arry: It is working fine now. there was some issue in SMTP and User 90 day password expired for all users leading to this issue. | Parveen Soni: Resolved
SH-4867,Meters not coming in first comm,Success Hub,Parveen Soni,CC:   ,Close,Issue,2025-04-10T12:15:57.822+0530,"Harsh Agarwal: Hi    sir, pls find below the list of meters which are not communicating but are power on onsite. | Parveen Soni: Fixed. | Automation for Jira: Hi Reporter, This Ticket is now moved to Review state and will be closed after T+3 business days. Please review this ticket and re-assign if any further assistance required from App Support | Automation for Jira: Dear Reporter, The ticket is closed as no response is received in T+3 days. Please reach out to App Support if any issues or concerns."
SH-4866,"HP Apraava | Need the list of 200 meters with max magnet tamper(201,202) count in last 7 days",Success Hub,Ayush Rajput,No description,Close,Service Request,2025-04-10T11:55:02.527+0530,"Automation for Jira: Hi Reporter, This Ticket is now moved to Review state and will be closed after T+3 business days. Please review this ticket and re-assign if any further assistance required from App Support"
SH-4864,Need Events Data for attached list of meters for which billing is not received within first 12 hrs on 1st April 2025,Success Hub,Ayush Rajput, please provide the data at the earliest.,Close,Service Request,2025-04-10T11:03:01.144+0530,"Anujaya.Singh:  FYI | Ayush Rajput:  | Automation for Jira: Hi Reporter, This Ticket is now moved to Review state and will be closed after T+3 business days. Please review this ticket and re-assign if any further assistance required from App Support | Automation for Jira: Dear Reporter, The ticket is closed as no response is received in T+3 days. Please reach out to App Support if any issues or concerns."
SH-4863,Required False magnetic tamper and LIFO issue meter list ,Success Hub,Aditya Yadav,Hi   : We required last 6 months (1 Sep 2024 to 10 April 2025) data of Single-phase RF meters which have following issue:,Close,Issue,2025-04-10T10:57:05.977+0530,"Aditya Yadav:     | Aditya Yadav:  | Aditya Yadav:  | Automation for Jira: Hi Reporter, This Ticket is now moved to Review state and will be closed after T+3 business days. Please review this ticket and re-assign if any further assistance required from App Support"
SH-4856,AMI 1&2 : Requirement of Gap reading commands from 1st April to 20th April,Success Hub,Ansh Sharma,"Please share the gap reading commands report added from the backend from April 1st to April 20th, as we are unable to export it from HES day-wise. This is very important as we are not achieving the desired LS SLA for AMI 1&2. Please share the excel day-wise, that will help.",Close,Service Request,2025-04-10T00:56:57.723+0530,"Satya Brat Nath:     Please update this ticket. Share the fail and success count meter wise - if GR data is large. | Satya Brat Nath:    Your intervention is required. | Ansh Sharma: As discussed, this is a huge data as lakhs of gap reading commands are inserted in a day. Please create an issue for gap reading commands. I will link the ticket created for devs there. | Automation for Jira: Hi Reporter, This Ticket is now moved to Review state and will be closed after T+3 business days. Please review this ticket and re-assign if any further assistance required from App Support | Automation for Jira: Dear Reporter, The ticket is closed as no response is received in T+3 days. Please reach out to App Support if any issues or concerns."
SH-4850,NTPC:  Block-Wise Correction is required.,Success Hub,Parveen Soni," As discussed, Please do the correction in Block-Wise for respective Meters in NTPC MDM. CC:   sir",Close,Service Request,2025-04-09T17:59:49.723+0530,"Parveen Soni: Updated   Could you please check once. | Satya Brat Nath: Ok i will check and update you. Till then please don't close the ticket  | Parveen Soni: sure | Automation for Jira: Hi Reporter, This Ticket is now moved to Review state and will be closed after T+3 business days. Please review this ticket and re-assign if any further assistance required from App Support | Automation for Jira: Dear Reporter, The ticket is closed as no response is received in T+3 days. Please reach out to App Support if any issues or concerns."
SH-4847,Current Reversal Report not working,Success Hub,Naman,No description,Close,Issue,2025-04-09T17:48:08.392+0530,"Naman: Hi    Please refer to this ticket for the same issue -  [SH-4490] Current reversal report not available in HES - Jira A bug had been raised for the same, this needs further investigation since this functionality is only working in Pkg 1,2 AFAIK and none another environment. Please refer to the attached ticket for updated. I am putting this to review | Automation for Jira: Hi Reporter, This Ticket is now moved to Review state and will be closed after T+3 business days. Please review this ticket and re-assign if any further assistance required from App Support | Automation for Jira: Dear Reporter, The ticket is closed as no response is received in T+3 days. Please reach out to App Support if any issues or concerns."
SH-4846,April month billing issues for HTCT meter: GVPR WB ,Success Hub,Nikhil Kumar,,Close,Issue,2025-04-09T16:48:52.113+0530,"Nikhil Kumar: For case 1: List contains 46 meters, out of which 10 were already validated,  and for rest 36 meters after discussing with the basant, also validated that meters. | Nikhil Kumar: For Case 2: List of 161 meters, some of the meters had manufacturer and DeviceId got swapped which happened for  Secure meters when Get Nameplate command on it got success, their DeviceId and Manufacturer got swap with each other. so after correcting that and again retriggering the bulk Billing ODR on same set of meters, All commands got success and only 30 meters commands got fail from that and that 30 meters were not in comm that time. | Automation for Jira: Hi Reporter, This Ticket is now moved to Review state and will be closed after T+3 business days. Please review this ticket and re-assign if any further assistance required from App Support"
SH-4845,"AMI 1&2 : SLA for LS is 87% for April, and no data on 6th April",Success Hub,Ansh Sharma,No SLA report is generated on 6th of April Please resolve this issue as the average % is very low (84%) cc :       ,Close,Service Request,2025-04-09T16:45:46.452+0530,"Satya Brat Nath: Same goes for DP SLA I am requesting to share daily SLA for  LS and DP from 1st April’25  from  DB data in weekly ticket.       cc :     | Ansh Sharma:  The job responsible for generating the SLA report failed in its execution somehow on 7th April. PFA the error logs regarding the same  Date		4/7/2025 6:15:00 PM Log		Job History (SLA_24Hrs_Import) Step ID		1 Server		HES-DBNODE-A Job Name		SLA_24Hrs_Import Step Name		InsertLS_SLA Duration		00:04:49 Sql Severity	21 Sql Message ID	596 Operator Emailed	 Operator Net sent	 Operator Paged	 Retries Attempted	0 Message Executed as user: AMIAPDCLAD\sqlsvc. Unspecified error occurred on SQL Server. Connection may have been terminated by the server. [SQLSTATE HY000] (Error 0)  Cannot continue the execution because the session is in the kill state. [SQLSTATE HY000] (Error 596).  The step failed. | Satya Brat Nath:  , I am not technically sound guy. You need to fix this asap so that SLA gets reflected in LS Reports.  | Satya Brat Nath:  I've noticed that the DP SLA Report displayed in the UI appears to be incorrect. Specifically, I've come across several meters where there is no DP present in MDM, yet the HES Report shows a DP for them. However, this discrepancy is not reflected in the DP Data itself. The reports are quite confusing at the moment. Could you please take a closer look into this? | Satya Brat Nath: Meanwhile, could you please share the LS DP SLA from 1st April to 15th April for all installed meters from the DB     | Satya Brat Nath:  its been 10 Days & we are still not having SLA Report of 6th April’25. Please expedite to resolve the issue & share us the SLA Data | Ansh Sharma: Hi    as discussed already with Taznur on phone call inserting the whole SLA again in the table would be a heavy task and not ideal in this situation. Hence as a workaround I am sharing the SLA in Excel from 1-15 April. PFA the sheet As for the gap reading analysis and pulling data if SLA is not met we can work that out on separate ticket. FYI putting this ticket in review. | Automation for Jira: Hi Reporter, This Ticket is now moved to Review state and will be closed after T+3 business days. Please review this ticket and re-assign if any further assistance required from App Support | Sayeed Rabbani:  I need the LS data from 6th April to 16th April for all installed meters from the DB. It would be great if you can share it by today. Cc:    | Automation for Jira: Dear Reporter, The ticket is closed as no response is received in T+3 days. Please reach out to App Support if any issues or concerns."
SH-4843,LS DP SLA Data Required from 1st to 10th April,Success Hub,Parveen Soni,No description,Close,Service Request,2025-04-09T16:26:56.808+0530,"Parveen Soni: Intelli pgk 1-2 hourly SLA 1Apr-10pr.xlsx | Automation for Jira: Hi Reporter, This Ticket is now moved to Review state and will be closed after T+3 business days. Please review this ticket and re-assign if any further assistance required from App Support | Automation for Jira: Dear Reporter, The ticket is closed as no response is received in T+3 days. Please reach out to App Support if any issues or concerns."
SH-4842,AMI 1&2 : DP validation required for 86 escalated meters by APDCL,Success Hub,Ansh Sharma,No description,In Progress,Service Request,2025-04-09T16:24:23.421+0530,"Sayeed Rabbani: Need validation.   Complaint coming from AGM sir, It's very urgent. | Ansh Sharma: I have validated the data for the following meters as push data was available for them.  | Ansh Sharma: For rest of the meters, it seems like a template issue since multiple parameters like IP and LS data are also missing. | Satya Brat Nath: what need to be done in these meters? As these meters are given by AGM of APDCL IT.  "
