Key,Summary,Project,Assignee,Description,Status,Issue Type,Created Date,Comments
SH-5200,Sikkim Anvil: LS and DP 0 even after meters communication.,Success Hub,Ansh Sharma,"Dear Ansh,  Please review the attached meters. The LS and DP are showing zero, even though the meters are communicating with the following SEP and HC. Kindly respond at your earliest convenience. CC:      FYI only.  ",In Progress,Service Request,2025-04-22T23:21:05.755+0530,"Ansh Sharma: Hi   , from the given data about 27 meters were installed on 20th April and their data is available for the following days. PFA the analysis for that.  For the rest of the meters upon doing analysis on single meters I found that their routing was not available for the days on which their data was not present. Please do the analysis for these meters considering a significant timestamp (atleast one week) so that we can find something conclusive. | Aditya Pradhan: Dear  , For LS, at least 23 meters has been routed for more than 10- 240 times but not a single LS has been pushed to HES, Please find the meter below. | Aditya Pradhan:  And for DP, 214 meters has been routed for 4- 240 times in 3 days, but not a single DP has been received in HES. Please look into this."
SH-5199,Power Outage events required from 21st March to 21st April,Success Hub,Ritik Kumar,No description,Close,Service Request,2025-04-22T22:21:35.788+0530,"Ritik Kumar:   pfa:   | Automation for Jira: Hi Reporter, This Ticket is now moved to Review state and will be closed after T+3 business days. Please review this ticket and re-assign if any further assistance required from App Support | Automation for Jira: Dear Reporter, The ticket is closed as no response is received in T+3 days. Please reach out to App Support if any issues or concerns."
SH-5195,HP APRAAVA | Need to increase the Infra sizing,Success Hub,Ayush Rajput,CPU utilization  during SAT Test cases,Close,Incident,2025-04-22T18:04:54.696+0530,Ayush Rajput: Infra is already increased so i am closing this ticket now.
SH-5191,Update SAT meter in SLA Report,Success Hub,Ritik Kumar,"Hi, As meters are Changed Smart to smart, we have received updated SAT meter list from Apraava . kindly update the same in respective SLA reports i.e. LS, DP & billing for SAT-1,2,3. PFA updated meters list with old & new meters.      ",Close,Service Request,2025-04-22T17:32:47.227+0530,"Ritik Kumar:  | Ritik Kumar: NEEDFUL HHAS BEEN DONE | Automation for Jira: Hi Reporter, This Ticket is now moved to Review state and will be closed after T+3 business days. Please review this ticket and re-assign if any further assistance required from App Support | Automation for Jira: Dear Reporter, The ticket is closed as no response is received in T+3 days. Please reach out to App Support if any issues or concerns."
SH-5190,Please share LS data for last 3 days for these meters to find LIFO cases,Success Hub,Aditya Yadav,Please share LS data for last 3 days for these meters to find LIFO cases,Close,Issue,2025-04-22T17:25:53.120+0530,"Automation for Jira: Hi Reporter, This Ticket is now moved to Review state and will be closed after T+3 business days. Please review this ticket and re-assign if any further assistance required from App Support"
SH-5189,HES SLA Percentage for NON-SAT Meters keeps Changing,Success Hub,Naman,No description,Open,Issue,2025-04-22T17:21:23.173+0530,"Yash Jain: Hi   , please find the snapshot of HES where the SLA percentages are different. In Morning around 8:30 AM the SLA Percentage for 8hr LS SLA for NON-SAT Meters was 87.74%. But now the SLA Percentage for the same has reduced to 87.37%"
SH-5187,Command response delayed to MDM when command triggered from MDM at DR environment_APDCL Apraava ,Success Hub,Ritik Kumar,"Command response delayed to MDM when command triggered from MDM at DR environment_APDCL Apraava. During DC/DR drill: command response found ok when HES prod. environment running at DC but command response delayed to MDM(taking approx 12hours) when command triggered from MDM at DR environment. To :    cc:     ,   ,   ,   ",Close,Issue,2025-04-22T14:43:37.648+0530,"Ritik Kumar: In DR, I have increased the Batch size and frequency in Notifier’config to the max as per availble scenario  and previosly it was processing 1K commands per hour and lates it started provessing 15K command per hour. this was limited to DR only | Automation for Jira: Hi Reporter, This Ticket is now moved to Review state and will be closed after T+3 business days. Please review this ticket and re-assign if any further assistance required from App Support | Automation for Jira: Dear Reporter, The ticket is closed as no response is received in T+3 days. Please reach out to App Support if any issues or concerns."
SH-5186,AMI CT : Requirement of SLA data for DTR from 1st to 20th April,Success Hub,Ansh Sharma,No description,Close,Service Request,2025-04-22T14:29:37.865+0530,"Ansh Sharma: PFA the requested data  | Automation for Jira: Hi Reporter, This Ticket is now moved to Review state and will be closed after T+3 business days. Please review this ticket and re-assign if any further assistance required from App Support | Satya Brat Nath:   Share IP and event data also. | Ansh Sharma: IP data was already present in the file. PFA the events data | Automation for Jira: Hi Reporter, This Ticket is now moved to Review state and will be closed after T+3 business days. Please review this ticket and re-assign if any further assistance required from App Support | Automation for Jira: Dear Reporter, The ticket is closed as no response is received in T+3 days. Please reach out to App Support if any issues or concerns."
SH-5185,RC-DC SLA exclusion 1st to 21st april'25,Success Hub,Nikhil Kumar,RC-DC SLA exclusion 1st to 21st april'25,Close,Service Request,2025-04-22T13:23:32.198+0530,"Nikhil Kumar:   | Automation for Jira: Hi Reporter, This Ticket is now moved to Review state and will be closed after T+3 business days. Please review this ticket and re-assign if any further assistance required from App Support | Automation for Jira: Dear Reporter, The ticket is closed as no response is received in T+3 days. Please reach out to App Support if any issues or concerns."
SH-5183,Techno | Need LS Data for CT meters,Success Hub,Parveen Soni,Please Share 1 Day LS Data for CT Meters.,Close,Service Request,2025-04-22T12:15:17.438+0530,"Parveen Soni: CT.Blockload 2025-04-22.csv | Parveen Soni: CT.Blockload 2025-04-22 (2).xlsx | Automation for Jira: Hi Reporter, This Ticket is now moved to Review state and will be closed after T+3 business days. Please review this ticket and re-assign if any further assistance required from App Support | Automation for Jira: Dear Reporter, The ticket is closed as no response is received in T+3 days. Please reach out to App Support if any issues or concerns."
SH-5182,"Required Meter list having ""New Firmware activate event"" received",Success Hub,Lyba Noor,Hi   : Can you check the following meters for receiving of “New firmware activate” event and share the list. Event ID: 157 Event date: 21.04.2025 & 22.04.2025 CC:   ,Close,Service Request,2025-04-22T12:03:51.574+0530,"Aditya Yadav:   | Automation for Jira: Hi Reporter, This Ticket is now moved to Review state and will be closed after T+3 business days. Please review this ticket and re-assign if any further assistance required from App Support"
SH-5181,RC/DC commands are not mapping in MDM properly for Apraava APDCL Project.,Success Hub,Shiva Sharma," , It has been observed that RC/DC commands are not mapping properly in MDM, which could potentially lead to an SLA breach. Out of approximately 20k commands triggered, 13k have been processed in HES, but only 3k are reflecting in MDM. This may impact SLA and could be escalated by the client.   will attach a detailed RC/DC analysis. Kindly look into this issue at your earliest convenience. CC: -      ",Open,Issue,2025-04-22T12:03:51.274+0530,Mubin Ahmed: 
SH-5180,Intelli Pkg-1&2 Event for RC-DC SLA report April'25,Success Hub,Parveen Soni,No description,Close,Service Request,2025-04-22T11:40:57.317+0530,"Parveen Soni:  Meter No list? | Saiful Ali Khan:  de raha hai event pull kar raha hu oske bad final list deta hu  | Krishnamani: Routing available , rc command is processing but meters are not getting success, kindly check   ji | Saiful Ali Khan:    Pl share power event , voltage event and control event from 1 April to 21 April 2025 | Saiful Ali Khan:   pl share  | Parveen Soni: Power event report April 2nd list.xlsx | Automation for Jira: Hi Reporter, This Ticket is now moved to Review state and will be closed after T+3 business days. Please review this ticket and re-assign if any further assistance required from App Support | Automation for Jira: Dear Reporter, The ticket is closed as no response is received in T+3 days. Please reach out to App Support if any issues or concerns."
SH-5177,AMI 1&2: DP Data missed on 169000+ Meters. ,Success Hub,Ansh Sharma,DP data in AMI 1&2 was missed. Approx 169000+ Meters have no DP Data received in HES and MDM too,Close,Incident,2025-04-22T08:14:47.916+0530,"Ansh Sharma: Hi  , we are looking into this issue | Satya Brat Nath:  While looking into the issue, I observed that more than 49% of the meters had missed DP data. Although around 93% of the meters were communicating from 12:00 AM, the expected automatic DP push did not occur.

Additionally, the GR was not getting added automatically to pull the missing packets, which further impacted data collection. To mitigate the issue and ensure continuity, I manually triggered the necessary backend commands for the affected meters.

May I kindly request you to look into this and share the RCA?    | Ansh Sharma: The issue is not with the push data. Everyday approx 60% of data is recieved via push and the rest is pulled by gapreading. However the gapreading was not functioning properly due to which this issue occured. But now we have added workarounds and no DP was missed today. Hence closing this ticket now fyi."
SH-5170,Power Outage events required from 1st to 20th April,Success Hub,Naman,No description,Close,Service Request,2025-04-21T22:52:39.767+0530,"Yash Jain: Hi   please share the outage events for the following list of meters.   | Naman: Update - The required data had been shared,  PFA -  Outage Req for SAT Meters.xlsx   let me know if anything remains, Moving this in review. | Automation for Jira: Hi Reporter, This Ticket is now moved to Review state and will be closed after T+3 business days. Please review this ticket and re-assign if any further assistance required from App Support | Automation for Jira: Dear Reporter, The ticket is closed as no response is received in T+3 days. Please reach out to App Support if any issues or concerns."
SH-5165,Need to SLA % for SAT-C,Success Hub,Ritik Kumar,"Hi, Please Share SLA % of SAT-C Meters in this Format.  ",Close,Service Request,2025-04-21T18:17:51.829+0530,"Ritik Kumar:   PFA:   | Automation for Jira: Hi Reporter, This Ticket is now moved to Review state and will be closed after T+3 business days. Please review this ticket and re-assign if any further assistance required from App Support | Automation for Jira: Dear Reporter, The ticket is closed as no response is received in T+3 days. Please reach out to App Support if any issues or concerns."
SH-5163,Low Gap Reco & overall command success rate MCL-HES,Success Hub,Ritik Kumar," Hello Ritik from the below table we can see that GR command success rate for BLP is very low from last 3-4 days, please check cc:       ",In Progress,Issue,2025-04-21T18:10:33.415+0530,"Ritik Kumar:   Can you please confirm if this consists of the meters from the new log where no push is being received, because   and I have rectified that there is a meter template ID issue. I’m getting this resolved shortly if those meters are impacted | Pratik Thakre:  This issue is with all types of meters new as well as with old lots | Pratik Thakre:  Overall command success rate is also low  | Ritik Kumar: what is the latest success rate   , as this was the issue related to routing issue. | Pratik Thakre:   Total HES Command status: Low HES command success rate from last 2 days as routing is still affected GR Commands status: Low GR command success rate from last 2 days as routing is still affected"
SH-5160,"Block Load Profile data and Events data(Outage, Over voltage , under voltage) for the meters (max duration possible )",Success Hub,Lyba Noor,Could you please get the following for at least 3 days for the data shared   :  1. Block Load Profile Data,Close,Service Request,2025-04-21T17:26:39.046+0530,"Lyba Noor: Hi    Sharing the data of previous 10 days for the given meters.      | Swapnil Roy: Hi   , Could you please fetch the data for the list of meters attached in this file as well, as this a urgent request we need to complete this activity by 3pm today    | Lyba Noor: Hi    sharing the block load data of previous 3 days for all the given meters. | Lyba Noor: Hi    sharing the events data of previous 3 days for all the meters. There was no event of under voltage and over voltage for CT meters from past 3 days,  For CT meters, there is event data showing an undervoltage on April 18th and an overvoltage on April 15th. If you need the data, let me know and I will share it.   | Automation for Jira: Hi Reporter, This Ticket is now moved to Review state and will be closed after T+3 business days. Please review this ticket and re-assign if any further assistance required from App Support | Automation for Jira: Dear Reporter, The ticket is closed as no response is received in T+3 days. Please reach out to App Support if any issues or concerns."
SH-5159,Need to register 2 LTCT meters on prod,Success Hub,Ritik Kumar,"Hi , Please register two meters on WB_apraava prod as meters are installed on field. detail attached.",Close,Service Request,2025-04-21T17:25:23.158+0530,"Ritik Kumar:  | Ritik Kumar:  | Ritik Kumar:  | Ritik Kumar: needful has been done | Automation for Jira: Hi Reporter, This Ticket is now moved to Review state and will be closed after T+3 business days. Please review this ticket and re-assign if any further assistance required from App Support | Automation for Jira: Dear Reporter, The ticket is closed as no response is received in T+3 days. Please reach out to App Support if any issues or concerns."
SH-5157,LS DP SLA Data Required from 11th April to 20th April,Success Hub,Parveen Soni,No description,Close,Service Request,2025-04-21T15:56:35.492+0530,"Yash Jain: Hi   sir, please share the LS and DP Data from 11th to 19th April. LS for 8hr and 12hr, DP for 12hr and 24hr. | Parveen Soni: Hourly SLA 11-20 Apr 2025.xlsx | Automation for Jira: Hi Reporter, This Ticket is now moved to Review state and will be closed after T+3 business days. Please review this ticket and re-assign if any further assistance required from App Support | Automation for Jira: Dear Reporter, The ticket is closed as no response is received in T+3 days. Please reach out to App Support if any issues or concerns."
SH-5156,Need to add Miss packet for SAT-4 meters,Success Hub,Ritik Kumar,"Hi, Please add miss packet for SAT-4 meters.",Close,Service Request,2025-04-21T15:15:54.759+0530,"Jitendra Verma:  Please add missed packet for remaining meters for the date range is (13th to 19th Apr). Divide the meters into two groups and add the GR for each group one by one.   | Ritik Kumar: added: select count(*),status from HESCommand nolock where commandtypeid = 21 and CreatedBy like 'GapFill_13-19' and CreatedDate between '2025-04-19 18:30' and GETUTCDATE() group by status | Jitendra Verma:  Please Share Update SLA date range of 13th to 20th Apr. | Ritik Kumar:   PFA   | Ritik Kumar:     | Jitendra Verma:  Please add missed packet for date range is 18th to 20th Apr.   | Ritik Kumar:   commands have been raised: | Jitendra Verma:  Please share updated SLA date range is 18th to 22nd April. | Ritik Kumar:   PFA:   | Ritik Kumar:   PFA   | Jitendra Verma: Please add missed packet for date range is 18th to 22nd Apr.   | Ritik Kumar: added: | Ritik Kumar:   PFA    | Jitendra Verma:  Please add missed packet date range is 18th to 23rd April.   | Ritik Kumar: added: | Jitendra Verma:  Commands are completed please share updated SLA of date range is 18th to 24th April. | Ritik Kumar:   PFA updated SLA I’ve also updated the created date of the data received via gap fill commands  to get the data to fall into 12 hr SLA   | Jitendra Verma:  Please add missed packet date range is 18th to 24th April.   | Jitendra Verma:  please share updated SLA of date range is 18th to 28th April. | Ritik Kumar:   PFA updated the SLA till 27th:   | Ritik Kumar:   Gapfill commands have been added from 18-24 for the mentioned meters: select count(*) ,status from HESCommand nolock where commandtypeid = 21 and CreatedBy like 'GapFill_18-24' and CreatedDate between '2025-04-27 18:30' and GETUTCDATE() group by status; | Jitendra Verma:  Please add missed packet date range is 18th to 27th April.   Commands are Completed. | Ritik Kumar: added the command: select count(*),s tatus from HESCommand nolock where commandtypeid = 21 and CreatedBy like 'GapFill_18-27' and CreatedDate between '2025-04-27 18:30' and GETUTCDATE() group by status; | Jitendra Verma:  Commands are completed.  Please update the created date of the data received via gap fill commands. to get the data to fall into 12 hr SLA, then share the updated data date range is  18th to 27th April . | Ritik Kumar:  | Jitendra Verma:  Please add missed packet date range is 18th to 27th April. | Ritik Kumar: added the commands:  select count(*),status from HESCommand nolock where commandtypeid = 21 and CreatedBy like 'GapFill_18-27-2' and CreatedDate between '2025-04-27 18:30' and GETUTCDATE() group by status; | Ritik Kumar: commands are almost completed | Jitendra Verma:  Commands are completed.  Please update the created date of the data received via gap fill commands. to get the data to fall into 12 hr SLA, then share the updated data date range is  25th March to 27th April . | Ritik Kumar:   pfa | Ritik Kumar: closing this as this is not req. | Automation for Jira: Hi Reporter, This Ticket is now moved to Review state and will be closed after T+3 business days. Please review this ticket and re-assign if any further assistance required from App Support | Automation for Jira: Dear Reporter, The ticket is closed as no response is received in T+3 days. Please reach out to App Support if any issues or concerns."
SH-5155,Required False magnetic tamper and LIFO issue meter list for NCC Nashik.,Success Hub,Ayush Rajput,"Hi,   sir, I need last 3 months (1 Jan 2025 to 20 April 2025) data of Single-phase RF meters which have following issue:  ",In Progress,Service Request,2025-04-21T15:06:57.865+0530,Ayush Rajput:  I am sharing the three sheet 1 - magnetic tamper event count meterwise for 1 week 2 - push data coming today with not having year 2025 3 - push data coming today with not having april month but year is 2025  
SH-5154,AMI 1&2: Need to check Meters in HES with Zero Power-On Duration in minutes. ,Success Hub,Ansh Sharma, Could you please share the list of meters where the power-on duration is recorded as zero in the billing profile? This will help us ensure accuracy and address any potential discrepancies promptly.,Close,Service Request,2025-04-21T15:04:36.066+0530,"Ansh Sharma:   | Automation for Jira: Hi Reporter, This Ticket is now moved to Review state and will be closed after T+3 business days. Please review this ticket and re-assign if any further assistance required from App Support"
SH-5153,AMI 1&2: DP Data not available in MDM for Billing. ,Success Hub,Ansh Sharma," , Can you please check the list which was mailed to us by AMISP. All these meters have no DP Data as per them. Can you please help me to validate these Meters DP Data as that consumer can be billed. Also, Can you please share me the DP data available in HES and pushed to MDM? So that i can write a reply to AMSIP on this. ",In Progress,Issue,2025-04-21T14:53:37.201+0530,Satya Brat Nath:  please share the data as discussed. | Satya Brat Nath:  Please share the data as discussed | Ansh Sharma: Please find the already validated DP data within last week for these meters
SH-5151,Exclusions not mapped properly in HES since 09-04-25 in Apraava APDCL.,Success Hub,Shiva Sharma," , It has been observed that exclusions are not being mapped in HES since 09-04-25. You may refer to the attached screenshot for reference. Kindly look into this issue at your earliest convenience. 08-04-25: - 09-04-25: -  CC:   ",Close,Service Request,2025-04-21T13:23:40.999+0530,"Automation for Jira: Hi Reporter, This Ticket is now moved to Review state and will be closed after T+3 business days. Please review this ticket and re-assign if any further assistance required from App Support | Automation for Jira: Dear Reporter, The ticket is closed as no response is received in T+3 days. Please reach out to App Support if any issues or concerns."
SH-5150,Please provide Sequence ID for these meters AP10414930 and AP10413510.,Success Hub,Shiva Sharma," , Please provide sequence ID for these two meters  AP10414930 and AP10413510. As there billing data is available in HES but not reflecting in MDM, to fetch the billing data sequence ID is required. Thanks!! CC :   ",Open,Service Request,2025-04-21T13:17:19.453+0530,
SH-5148,High count of SyncRTCV2 commands are being initiated ,Success Hub,Aditya Yadav,High count of SyncRTCV2 commands are being initiated CC       ,Close,Issue,2025-04-21T11:13:51.286+0530,"Chandrendra Singh Chauhan:     Pls look into this Syc RTC 3.5 Lac triggered since 21st April. It is affecting regular GR commands success rate      Impact- Commands stuck as pending RTC sync is not happening, seen abnormal behavior. | Ranjeet Singh:   can you check this please | Ansh Sharma: For now I have failed all the syncRTC commands and disabled the functionality to add these commands. I tried restarting the service which was adding these commands but was unable to access the server. I have contacted devops to resolve the same.  These commands started adding post latest tag deployment i.e. on 17th.   Please call me out if the commands these commands start to add again. | Khushi Khari:  SyncRTCV2 commands are not being added since last night, but we have observed that high number of GR commands are still in pending and found an abnormality of commands added with ZERO tries so far, attached screen shot. | Aditya Yadav:   need to check the service logs for this, which can only be accessed through servers which are currently inaccessible,  Is working on it with infra team | Aditya Yadav:   GR service was experiencing timeouts, I have restarted it and now commands are processing, I am monitoring the GR in case timeout occurs again Since it is a different issue, we can open a different ticket for this, putting this ticket in review since SyncRTC commands are not getting added now as confirmed by you | Automation for Jira: Hi Reporter, This Ticket is now moved to Review state and will be closed after T+3 business days. Please review this ticket and re-assign if any further assistance required from App Support | Automation for Jira: Dear Reporter, The ticket is closed as no response is received in T+3 days. Please reach out to App Support if any issues or concerns."
SH-5147,Anvil Sikkim: Historical routing required from 1st april- 20th April.,Success Hub,Ansh Sharma,"Dear Ansh, Need the routing details from 1st april to 20th april of all the meter that has been registered in HES. CC:     FYI only.",Close,Service Request,2025-04-21T11:04:08.834+0530,"Ansh Sharma: As discussed, only 3 days data is stored in routing table    | Automation for Jira: Hi Reporter, This Ticket is now moved to Review state and will be closed after T+3 business days. Please review this ticket and re-assign if any further assistance required from App Support | Automation for Jira: Dear Reporter, The ticket is closed as no response is received in T+3 days. Please reach out to App Support if any issues or concerns."
SH-5145,Intelli Pkg-1&2 DR DB down,Success Hub,Ritik Kumar,No description,Close,Incident,2025-04-21T07:58:13.577+0530,"Ritik Kumar: We are not having any error logs captured in any of the services. | Ritik Kumar: Only 5 gateways are up as of now: ASGU100875 ASGU100887 ASGU101035 ASGU101282 ASGU101368 and we are getting data from these gateways, routing and rawdata both | Ritik Kumar: ASGU100875  ASGU101282 ASGU100887 IPV4  -------------------------------------- ASGU101368 ASGU101035 IPV 6   | Parveen Soni: Its resolved now  the issue was from Firewall related which comes under the ESDS."
SH-5131,APDCL:APRAAVA- Required 2 test meters in HES TND for RC/DC testing,Success Hub,Shiva Sharma,"APDCL APRAAVA- Required 2 test meters in HES TND for the RCDC Testing (API changed at MDM end). Meter no. already shared on email but work pending last 10 days Meter no. AP16002515 at Stagging HES Meter no. AS9003833 at EQA HES To    CC:   ,   ,   ,   ",Close,Issue,2025-04-20T15:40:12.970+0530,"Automation for Jira: Hi Reporter, This Ticket is now moved to Review state and will be closed after T+3 business days. Please review this ticket and re-assign if any further assistance required from App Support | Shiva Sharma: Marked this as close as we’ve demonstrated the changes with MDM today. Thanks!!"
